{"allowed_controls":[{"default":1.0,"id":"velocity_multiplier","max":1.5,"meaning":"Supuesto del usuario sobre ritmo: no es un coeficiente estimado ni efecto causal.","min":0.5}],"assumptions":["El ritmo reciente es una referencia útil.","No entran nuevas unidades.","Ventas acotadas al stock disponible."],"classification":"SYNTHETIC","data_pack_id":"housing-data","evidence_type":"predictive","execution":"external_python","explanation":"Promedia las ventas de los tres meses anteriores y aplica el límite del stock. Es un baseline auditable, no ML entrenado.","family":"moving_average_3","features":["sales_lag_1","sales_lag_2","sales_lag_3","stock_close"],"id":"housing-model","kind":"model","label":"DEMO / SYNTHETIC DATA","limitations":["No estima elasticidad ni causalidad.","No aprende cambios de régimen o estacionalidad.","No constituye recomendación de pricing."],"metrics":[{"interpretation":"Error absoluto medio: distancia típica en unidades sobre los últimos tres meses de cada proyecto; algoritmo fijo, actualización secuencial.","n":6,"name":"MAE","partition":"temporal_holdout","unit":"unidades/mes","value":1.3333333333333333}],"parameters":{"stock_cap":true,"window":3},"provenance":{"as_of":"2026-10-01","dataset_sha256":"056f0d8331eeb8a3751c03063740f248a4942c7a21fc54e10b4b77fce27bf2ed","generated_at":"2026-10-09T18:00:00Z","limitations":["Datos inventados exclusivamente para demostración.","Sin reposiciones, anulaciones intermedias ni cambios de universo."],"semantics":"SYNTHETIC_DEMO","source":"Authored deterministic fixture housing-v1","transformation":"Meses completos; cohorte fija; media móvil de tres meses limitada por stock."},"question":"¿Qué ritmo sugiere el trimestre reciente para el siguiente mes?","results":[{"horizon":1,"origin":"2026-09-01","prediction":3.3333333333333335,"project":"DEMO-A","stock":67},{"horizon":1,"origin":"2026-09-01","prediction":7.666666666666667,"project":"DEMO-B","stock":64}],"schema_version":"1.0.0","target":"Ventas del siguiente mes; unidades de la cohorte disponible.","training_period":{"end":"2026-09-01","start":"2026-01-01"},"uncertainty":{"explanation":"Muestra pequeña: no se publican intervalos calibrados. Los escenarios no son intervalos de confianza.","status":"NOT_ESTIMATED"},"validation":"Últimos tres meses por proyecto; cada origen usa solo tres meses anteriores. Baseline simple sin selección de hiperparámetros. Historia sintética o revisada: no certifica calidad prospectiva.","version":"1.0.0"}
